e.id,p.id,u.id,status,title,body,responder_id,response
1,1,1,PENDING,Flat Layout Question,Can I see the floor plan for 3-Room flats?,null,null,
2,1,2,CLOSED,Application Timeline,When will we know the results?,7,Results will be published within 3 weeks of application closing date.,
3,2,4,PENDING,Construction Completion,What is the expected completion date?,null,null,
4,1,3,PENDING,Nearby Amenities,Are there any schools nearby?,null,null,
5,1,5,CLOSED,Test,How can I withdraw my application?,6,You can request withdrawal through the system and it will be reviewed.,
